{"question": "I'm a magizoologist studying unusual creatures in my sanctuary. I need to understand their behaviors and characteristics through logical reasoning. Here's what I've observed so far:\n\n* either moonwolf is telepathic and moonwolf is shadow_walking, or phoenixling is time_bending and phoenixling is invisibility_capable\n  Eq: `{A(a())B(a()),D(b())C(b())}`\n* moonwolf is telepathic\n  Eq: `{A(a())}`\n\nFor the purpose of this question, I want you to write what follows in English. Please be succinct, precise and clear in your answer. Write a logical statement of the form \"From the premises, we can conclude that ...\" and then clearly write your conclusion. Please be succinct, precise, and clear.\n\nWhat if anything follows?\n\nI want you to answer immediately. Do not think about it at all, just immediately answer.\n\nWhat follows? Answer in the format that I showed you. Write \"Answer: {logical statement}\".", "scoring_guide": {"etr_predicted": "{B(a())}", "etr_predicted_is_classically_correct": false, "generation_details": {"atoms_distributed_over_views_SMT_ONLY": 3, "total_num_atoms": 5, "num_predicates_per_problem": 3, "num_objects_per_problem": 3, "premises_etr": ["{A(a())B(a()),D(b())C(b())}", "{A(a())}"], "premises_fnodes": ["((A(a) & B(a)) | (D(b) & C(b)))", "A(a)"], "is_chain_of_thought": false}, "open_ended": {"conclusion_agrees_in_yes_no_case": false, "short_name_to_full_name": {"A": "telepathic", "a": "moonwolf", "B": "shadow_walking", "D": "time_bending", "b": "phoenixling", "C": "invisibility_capable", "c": "shadowdrake"}}}}
{"question": "I'm an alchemist studying mysterious substances in my laboratory. I need to understand their properties through logical reasoning. Here's what I've discovered:\n\n* either universal_solvent is consciousness_expanding and prima_materia is immortality_granting and prima_materia is reality_altering, or ethereal_oil is time_bending and ethereal_oil is void_creating\n  Eq: `{E(c()*)A(a())B(a()),D(b())C(b())}`\n* prima_materia is immortality_granting\n  Eq: `{A(a())}`\n\nFor the purpose of this question, I want you to write what follows in English. Please be succinct, precise and clear in your answer. Write a logical statement of the form \"From the premises, we can conclude that ...\" and then clearly write your conclusion. Please be succinct, precise, and clear.\n\nWhat if anything follows?\n\nI want you to answer immediately. Do not think about it at all, just immediately answer.\n\nWhat follows? Answer in the format that I showed you. Write \"Answer: {logical statement}\".", "scoring_guide": {"etr_predicted": "{E(c()*)B(a())}", "etr_predicted_is_classically_correct": false, "generation_details": {"atoms_distributed_over_views_SMT_ONLY": 3, "total_num_atoms": 6, "num_predicates_per_problem": 3, "num_objects_per_problem": 3, "premises_etr": ["{E(c()*)A(a())B(a()),D(b())C(b())}", "{A(a())}"], "premises_fnodes": ["((E(c) & A(a) & B(a)) | (D(b) & C(b)))", "A(a)"], "is_chain_of_thought": false}, "open_ended": {"conclusion_agrees_in_yes_no_case": true, "short_name_to_full_name": {"E": "consciousness_expanding", "c": "universal_solvent", "A": "immortality_granting", "a": "prima_materia", "B": "reality_altering", "D": "time_bending", "b": "ethereal_oil", "C": "void_creating"}}}}
{"question": "I'm a dimensional cartographer mapping regions of parallel universes. I need to understand their properties through logical analysis. Here's what I've mapped:\n\n* either dream_realm is reality_bending and dream_realm is infinity_containing, or mirror_world is not infinity_containing and probability_realm is time_warping and probability_realm is probability_shifting\n  Eq: `{A(a())B(a()),~B(c()*)D(b())C(b())}`\n* dream_realm is reality_bending\n  Eq: `{A(a())}`\n\nFor the purpose of this question, I want you to write what follows in English. Please be succinct, precise and clear in your answer. Write a logical statement of the form \"From the premises, we can conclude that ...\" and then clearly write your conclusion. Please be succinct, precise, and clear.\n\nWhat if anything follows?\n\nI want you to answer immediately. Do not think about it at all, just immediately answer.\n\nWhat follows? Answer in the format that I showed you. Write \"Answer: {logical statement}\".", "scoring_guide": {"etr_predicted": "{B(a())}", "etr_predicted_is_classically_correct": false, "generation_details": {"atoms_distributed_over_views_SMT_ONLY": 3, "total_num_atoms": 6, "num_predicates_per_problem": 3, "num_objects_per_problem": 3, "premises_etr": ["{A(a())B(a()),~B(c()*)D(b())C(b())}", "{A(a())}"], "premises_fnodes": ["((A(a) & B(a)) | ((! ~B(c)) & D(b) & C(b)))", "A(a)"], "is_chain_of_thought": false}, "open_ended": {"conclusion_agrees_in_yes_no_case": false, "short_name_to_full_name": {"A": "reality_bending", "a": "dream_realm", "B": "infinity_containing", "c": "mirror_world", "D": "time_warping", "b": "probability_realm", "C": "probability_shifting"}}}}
{"question": "I'm a magizoologist studying unusual creatures in my sanctuary. I need to understand their behaviors and characteristics through logical reasoning. Here's what I've observed so far:\n\n* either moonwolf is telepathic and moonwolf is shadow_walking, or shadowdrake is not telepathic, or phoenixling is time_bending and phoenixling is invisibility_capable\n  Eq: `{A(a())B(a()),D(b())C(b()),~A(c())}`\n* moonwolf is telepathic\n  Eq: `{A(a())}`\n\nFor the purpose of this question, I want you to write what follows in English. Please be succinct, precise and clear in your answer. Write a logical statement of the form \"From the premises, we can conclude that ...\" and then clearly write your conclusion. Please be succinct, precise, and clear.\n\nWhat if anything follows?\n\nI want you to answer immediately. Do not think about it at all, just immediately answer.\n\nWhat follows? Answer in the format that I showed you. Write \"Answer: {logical statement}\".", "scoring_guide": {"etr_predicted": "{B(a())}", "etr_predicted_is_classically_correct": false, "generation_details": {"atoms_distributed_over_views_SMT_ONLY": 3, "total_num_atoms": 6, "num_predicates_per_problem": 3, "num_objects_per_problem": 3, "premises_etr": ["{A(a())B(a()),D(b())C(b()),~A(c())}", "{A(a())}"], "premises_fnodes": ["((A(a) & B(a)) | (! ~A(c)) | (D(b) & C(b)))", "A(a)"], "is_chain_of_thought": false}, "open_ended": {"conclusion_agrees_in_yes_no_case": false, "short_name_to_full_name": {"A": "telepathic", "a": "moonwolf", "B": "shadow_walking", "D": "time_bending", "b": "phoenixling", "C": "invisibility_capable", "c": "shadowdrake"}}}}
